Artista,Género musical,Tipo,Nombre,Año de lanzamiento,ID_Spotify,ID_Album,Popularidad,Biografia_Resumen,Playcount_LastFM,Listeners_LastFM
George McCrae,Reggaeton (Origen: Rock),Canción,Rock Your Baby,2010,6pMHMzwTsWIxLigr54GGVm,1Vmgke5bm1op8mUnbvd6wY,63,"George McCrae (born October 19, 1944) is a Soul and Disco singer. McCrae was born in West Palm Beach, Florida. He formed his own singing group, the Jivin' Jets, before joining the United States Navy in 1963. Four years later, he reformed the group, with his wife Gwen joining the line-up, but soon afterwards they decided to work as a duo, recording for Henry Stone's Alston record label. Gwen then won a solo contract, with George acting as her manager as well as doing some singing on sessions and in clubs. <a href=""https://www.last.fm/music/George+McCrae"">Read more on Last.fm</a>",1780733,328181
Falco,Reggaeton (Origen: Rock),Canción,Rock Me Amadeus,2010,0wbdaBHi8t5e7EqXV88nka,4nZCwWIMMiHsRbGIVv28eU,49,"Johann ""Hans"" Hölzel (19 February 1957 – 6 February 1998), better known by his stage name Falco (from Falko Weißpflog), was an Austrian singer and musician. He had several international hits, including ""Der Kommissar"" (1981), ""Rock Me Amadeus"", ""Vienna Calling"", ""Jeanny"", ""The Sound of Musik"", ""Coming Home (Jeanny Part II, One Year Later)"", and posthumously ""Out of the Dark"".

""Rock Me Amadeus"" reached No. 1 on the Billboard charts in 1986, making <a href=""https://www.last.fm/music/Falco"">Read more on Last.fm</a>",12267958,826091
Skrillex,Reggaeton (Origen: Rock),Canción,Rock 'n' Roll (Will Take You to the Mountain),2010,6TbYnMMWfdUZXQm6tZ6vib,6HbNEBza64W10MQxUFq6QL,53,"Skrillex is the pseudonym used by Los Angeles, California, USA musician Sonny Moore to differentiate his electronic solo work from his work with From First to Last and his other solo projects. 

As Skrillex, Moore is an electronic DJ and producer boasting a musical style that incorporates electro house, fidget house, and brostep. Moore began producing and performing under the alias Skrillex at clubs in the Los Angeles area in 2008.  

Throughout 2010, Skrillex became a bigger and bigger part of Moore’s life. <a href=""https://www.last.fm/music/Skrillex"">Read more on Last.fm</a>",103768341,2891523
Far East Movement,Reggaeton (Origen: Rock),Canción,Rocketeer,2010,3ZuiIFm9nRnkRz8AZAekjJ,4axgysRjIB7ToC0DA7uxXC,68,"The Far East Movement (also known as FM), hailing from the clubs and streets of Los Angeles, California, United States, are one of the freshest crews representing the next generation of artists and “fly music.” Members Kev Nish, Prohgress, J-Splif, and DJ Virman have created a huge industry buzz with major companies, radio stations, and club DJs worldwide through their international appeal and energetic live shows. 

Finding their inspiration from the diverse city blocks and night club scene of Southern California <a href=""https://www.last.fm/music/Far+East+Movement"">Read more on Last.fm</a>",23790396,2124534
Deftones,Reggaeton (Origen: Rock),Canción,Rocket Skates,2010,6Q7POvDeFGVFDYPmz7huYP,1GjjBpY2iDwSQs5bykQI5e,59,"Deftones is an American metal band from Sacramento, California, formed in 1988, consisting of Chino Moreno (lead vocals and guitar), Stephen Carpenter (guitar), Frank Delgado (keyboards and turntables), and Abe Cunningham (drums and percussion). Vega (formerly of Quicksand) took on bass duties from mid-2009 to ca. 2021 in substitution for Chi Cheng, who was seriously injured in an automobile accident in Santa Clara, California on November 4, 2008. <a href=""https://www.last.fm/music/Deftones"">Read more on Last.fm</a>",523845150,4052773
The High Kings,Reggaeton (Origen: Rock),Canción,The Rocky Road to Dublin,2010,07HkevwkwmCXWjQhgBei1V,7D5xUGsOC4j2B4a58iQFJh,53,"The High Kings is an Irish ballad group formed by the same creators as Celtic Woman. Finbarr Clancy, Brian Dunphy, Martin Furey, and Darren Holden make up the group.  <a href=""https://www.last.fm/music/The+High+Kings"">Read more on Last.fm</a>",2366378,155866
Falco,Reggaeton (Origen: Rock),Canción,Rock Me Amadeus,2010,4pEXlAqaJXQUKDteKRLun9,68NAVoAetddiH0ZJzU6Zhs,44,"Johann ""Hans"" Hölzel (19 February 1957 – 6 February 1998), better known by his stage name Falco (from Falko Weißpflog), was an Austrian singer and musician. He had several international hits, including ""Der Kommissar"" (1981), ""Rock Me Amadeus"", ""Vienna Calling"", ""Jeanny"", ""The Sound of Musik"", ""Coming Home (Jeanny Part II, One Year Later)"", and posthumously ""Out of the Dark"".

""Rock Me Amadeus"" reached No. 1 on the Billboard charts in 1986, making <a href=""https://www.last.fm/music/Falco"">Read more on Last.fm</a>",12267958,826091
Metric,Reggaeton (Origen: Rock),Canción,Black Sheep - Brie Larson Vocal Version,2010,60TThBDrPpek5k520l0W0L,3blvQlrV0IeDBOWqDz2yYd,74,"Metric are an indie rock/New Wave band formed in 1998 in Toronto, Canada. The band members are Emily Haines (vocals, synths, guitar, tambourine), James Shaw (guitar, synths, theremin, backing vocals), Josh Winstead (bass, synths, backing vocals) and Joules Scott-Key (drums). The band name was inspired after a sound called ""Metric"" that was programmed by Shaw on his keyboard. They were based at various times at Toronto, Montreal, London, NYC and LA. <a href=""https://www.last.fm/music/Metric"">Read more on Last.fm</a>",108269225,2737766
Robbie Williams,Reggaeton (Origen: Rock),Canción,Rock DJ - 2004 Mix,2010,0lJEYLAJU5KtthQroas2ou,3KnJzJIjhNYr7G1VErTLH3,49,"Robert Peter Williams (born 13 February 1974) is an English singer and songwriter. He found fame as a member of the pop group Take That from 1990 to 1995, and achieved commercial success after launching a solo career in 1996. His debut studio album, Life thru a Lens, was released in 1997, and included his signature song, ""Angels"". His second album, I've Been Expecting You, featured the songs ""Millennium"" and ""She's the One"", his first number one singles. <a href=""https://www.last.fm/music/Robbie+Williams"">Read more on Last.fm</a>",70135511,2785040
Bunbury,Reggaeton (Origen: Rock),Canción,De todo el mundo,2010,3yYStumyNYWPHCPHLDxy99,2oOUx7YZnwBm4tshQbhdyO,62," <a href=""https://www.last.fm/music/+noredirect/Bunbury"">Read more on Last.fm</a>",5260706,147349
Demi Lovato,Reggaeton (Origen: Rock),Canción,"Wouldn't Change a Thing - From ""Camp Rock 2: The Final Jam""",2010,0Di5p4ItolIUZB8c2P0pvs,5iK842b9xnZblgZkRxWCFe,65,"Demetria Devonne Lovato, professionally known as Demi Lovato, is an American singer, songwriter and actress. After appearing on the children's television series Barney & Friends (2002–2004), Lovato rose to prominence for playing Mitchie Torres in the musical television film Camp Rock (2008) and its sequel Camp Rock 2: The Final Jam (2010); the former film's soundtrack contained ""This Is Me"", Lovato's debut single and duet with Joe Jonas, which peaked at number nine on the Billboard Hot 100. <a href=""https://www.last.fm/music/Demi+Lovato"">Read more on Last.fm</a>",190835659,3237571
Linkin Park,Reggaeton (Origen: Rock),Canción,Iridescent,2010,69ZEgPX0hxWXJIqkTlYz41,5uvXx5ZQswNRFCdHR521YZ,66,"Linkin Park is an American alternative rock band from Agoura Hills, California. The band's current lineup comprises of vocalist/rhythm guitarist/keyboardist Mike Shinoda, lead guitarist Brad Delson, bassist Dave Farrell, DJ/turntablist Joe Hahn, drummer Colin Brittain, and lead vocalist Emily Armstrong. Shinoda, Delson, Farrell and Hahn are founding members. Vocalists Mark Wakefield, Chester Bennington & drummer Rob Bourdon are former members of the band. <a href=""https://www.last.fm/music/Linkin+Park"">Read more on Last.fm</a>",699855678,6737591
Linkin Park,Reggaeton (Origen: Rock),Canción,The Catalyst,2010,5bvgRxco3jgSZ3SP8rueDA,5uvXx5ZQswNRFCdHR521YZ,68,"Linkin Park is an American alternative rock band from Agoura Hills, California. The band's current lineup comprises of vocalist/rhythm guitarist/keyboardist Mike Shinoda, lead guitarist Brad Delson, bassist Dave Farrell, DJ/turntablist Joe Hahn, drummer Colin Brittain, and lead vocalist Emily Armstrong. Shinoda, Delson, Farrell and Hahn are founding members. Vocalists Mark Wakefield, Chester Bennington & drummer Rob Bourdon are former members of the band. <a href=""https://www.last.fm/music/Linkin+Park"">Read more on Last.fm</a>",699855678,6737591
Wig Wam,Reggaeton (Origen: Rock),Canción,Do Ya Wanna Taste It,2010,5XW4BwCrfYpci5zMbJxs4N,4LC0EgGdIMtdpsssOLCJ1T,67,"Wig Wam is a Norwegian rock band, which is dedicated to the Glam rock, Glam metal and imitates the style of typical American rock bands from the 1980s.

Wig Wam come from Norway, more specifically the county of Østfold, and they were founded in 2001. Before their establishment the band members were already active in the music business, playing in bands like Dream Police, Artch, Sha-Boom, Ole Evenrud, Heads'N Tails and Alien, or as solo artists. Wig Wam worked hard to get to the top of the national charts <a href=""https://www.last.fm/music/Wig+Wam"">Read more on Last.fm</a>",2403387,148230
Apocalyptica,Reggaeton (Origen: Rock),Canción,Not Strong Enough,2010,6BD9XMxKnjL6dCJbxXAPUa,5I3AYgFwAzIQlYM2XImPfb,68,"Apocalyptica is a band from Helsinki, Finland consisting of three classically-trained cellists and a drummer. Their speciality is heavy metal music on cellos, though they also play classical music.

They started in 1993 by playing covers of Metallica, but once the concept became popular they wrote their own original works, maintaining the thrash metal influences on their albums Inquisition Symphony (mainly covers as well) and Cult. Since Reflections they have added drums to their recordings and live performances. <a href=""https://www.last.fm/music/Apocalyptica"">Read more on Last.fm</a>",69510376,1620651
Avenged Sevenfold,Reggaeton (Origen: Rock),Canción,So Far Away,2010,7Hr1Ignop7cymbE3FbOtXa,7vfuTRXIAYJz5Uc8SddnTr,72,"Avenged Sevenfold (often abbreviated to A7X) is a heavy metal/hard rock band which formed in 1999 in Huntington Beach, California, United States. The band consists of vocalist M. Shadows, lead guitarist Synyster Gates, rhythm guitarist Zacky Vengeance, bassist Johnny Christ, and former Bad Religion and Suicidal Tendencies drummer Brooks Wackerman (2016-present). Heartbreakingly, the band's best friend and original drummer James ""The Rev"" Sullivan passed away in 2009. <a href=""https://www.last.fm/music/Avenged+Sevenfold"">Read more on Last.fm</a>",218173719,2794560
Rockwell,Reggaeton (Origen: Rock),Canción,Somebody's Watching Me,2010,2gGdO0zLa9W8ce1Ig0BzFK,77zu6NfDouq2TomJaVadKb,64,"There are, at least, six artists known as Rockwell.

1) A pseudonym of Kenneth Gordy, from Detroit, Michigan: The son of Motown Records' founder, Berry Gordy, he changed his name so as to avoid charges of nepotism, wanting to make it in the music business on just his talent. He signed to Motown as a solo artist without his father's knowledge, taking his name from his high school band. His first single, the Michael Jackson-esque ""Somebody's Watching Me"". <a href=""https://www.last.fm/music/Rockwell"">Read more on Last.fm</a>",6708096,1103699
Caramelos De Cianuro,Reggaeton (Origen: Rock),Canción,Rubia Sol Morena Luna,2010,10BpvV0IRrd7D0gtHrBTN2,249zicrXA7A4UjOrJnxeb0,60,"Caramelos de Cianuro is a Latin rock band from Venezuela. The band was formed in 1991, and recorded their first songs, ""Nadando a Traves De la Galaxia"" and ""Tu Mama Te Va a Pegar"", in 1992. A year later, the group signed up to CNR and released an EP called Las Paticas de la Abuela, followed by the band's first album, Cuentos Para Adultos, in 1994. Performing a mixture of Latin ska and pop rock, Caramelos de Cianuro returned in 1996 with Harakiri City, released by Polygram. <a href=""https://www.last.fm/music/Caramelos+de+Cianuro"">Read more on Last.fm</a>",2192486,60187
Tan Bionica,Reggaeton (Origen: Rock),Canción,Obsesionario en La Mayor,2010,2YNMRnIJMCxDQWYfXRxJmB,1vALPYnFhuoeFte9ZHIc7j,71,"Tan Biónica is a pop rock band from Argentina. The group was formed in 2002 in Buenos Aires by vocalist Santiago ""Chano"" Moreno Charpentier, his younger brother Gonzalo ""Bambi"" Moreno Charpentier, Sebastián Seoane (guitar), and Diego Lichtenstein (drums). Tan Biónica worked on the soundtracks for the telenovelas Graduados and Viudas e hijos del Rock and Roll.

Tan Biónica enjoyed significant radio airplay and fame after the release of their second studio album, Obsesionario, in 2010. <a href=""https://www.last.fm/music/Tan+Bionica"">Read more on Last.fm</a>",5746897,98371
Kanye West,Reggaeton (Origen: Rock),Canción,Dark Fantasy,2010,7yNK27ZTpHew0c55VvIJgm,20r762YmB5HeofjMCiPMLv,70,"Ye, born Kanye Omari West on June 8, 1977, is an American rapper, singer, songwriter, record producer, and fashion designer. He is one of the most prominent figures in hip hop, known for his diverse musical style and polarizing cultural and political commentary. After dropping out of college to pursue a career in music, West began producing for regional artists in the Chicago area. As an in-house producer for Roc-A-Fella Records, he co-produced albums including Jay-Z's The Blueprint (2001) before signing with the label as a recording artist. <a href=""https://www.last.fm/music/Kanye+West"">Read more on Last.fm</a>",1445924983,7751041
Jamiroquai,Reggaeton (Origen: Rock),Canción,White Knuckle Ride,2010,7LWXh2JPLzKt1dla81mWWt,5mTP7Oivpq88d7ZQ9DBt4F,56,"Jamiroquai is an English funk and acid jazz band from London. Formed in 1992, they are fronted by vocalist Jay Kay, and were prominent in the London-based funk and acid jazz movement of the 1990s. They built on their acid jazz sound in their early releases and later drew from rock, disco, electronic and Latin music genres. Lyrically, the group has addressed social and environmental justice. Kay has remained as the only original member through several line-up changes. <a href=""https://www.last.fm/music/Jamiroquai"">Read more on Last.fm</a>",98902130,2770951
The Black Jets,Reggaeton (Origen: Rock),Canción,I Love Rock 'n' Roll,2010,06qEGQMavekDfu9fVsFAMz,7MlkH4VAR03h19qaTVMFjn,57," <a href=""https://www.last.fm/music/The+Black+Jets"">Read more on Last.fm</a>",292445,68065
Zoé,Reggaeton (Origen: Rock),Canción,Nada,2010,1lpGX4TZPVgEKGGBDc3n9j,45DCXNwdmaIt0kwAnqrVnG,71,"There are, at least, three artists known as Zoé: 1) A Mexican rock band. 2) An aka of Zoë Pollock (also, aka Zoë). 3) A French-speaking variétés françaises singer.

1) A Mexican rock band, that's not not afraid of experimenting, with a modern sound, an eclectic style, some British influences & overall, their music's sophisticated without loss of rock energy. Their lyrics cover many subjects / feelings, with the same level of sophistication that their music shows, plus honesty. <a href=""https://www.last.fm/music/+noredirect/Zo%C3%A9"">Read more on Last.fm</a>",26591906,458685
Foxy Shazam,Reggaeton (Origen: Rock),Canción,Oh Lord,2010,5iJU96441eAZ2VdWgxdyJa,4dhCjrqhvcGuIAcP2JIVaR,71,"Foxy Shazam is an American rock band from Cincinnati, Ohio, formed in 2004. The band consists of lead vocalist Eric Nally, guitarist Loren Turner, pianist Sky White, and bass player Daisy. After forming the band immediately recorded The Flamingo Trigger independently, then committed to an extensive national touring regimen. Shortly there after Foxy signed with Ferret Records and recorded their second album, Introducing Foxy Shazam, which was produced by Casey Bates (Chiodos, Portugal. <a href=""https://www.last.fm/music/Foxy+Shazam"">Read more on Last.fm</a>",6392051,228807
Nick Jonas,Reggaeton (Origen: Rock),Canción,"Introducing Me - From ""Camp Rock 2: The Final Jam""",2010,74tQaH4CxM5Rs9BzerEbHr,5iK842b9xnZblgZkRxWCFe,64,"
Nicholas Jerry ""Nick"" Jonas (born September 16, 1992) is an American singer-songwriter and actor best known as one of the Jonas Brothers, a pop-rock band he formed with his brothers Joe and Kevin. After 2010, Nick has focused primarily on his own career, releasing solo material, appearing in musicals, and acting in film and television.

A performer since the age of seven (the age at which he joined the Broadway cast of Annie Get Your Gun), Nicholas made his songwriting debut in 2002 <a href=""https://www.last.fm/music/Nick+Jonas"">Read more on Last.fm</a>",20937745,1257075
Desakato,Reggaeton (Origen: Rock),Canción,Cada vez,2010,5rVcMAD2j9y4veNGUxljby,7xGnuyXs2tR5uzCwquBz9j,43,"Desakato is a band from Llanera (Asturias, Spain), formed in 2003 as an initiative from Pablo and Mario (singer/rythm guitar and bass respectively) who had been leaping from group to group not finding a sound they liked. They teamed up with guitarist Gabri and started playing covers and writing their own songs. Drumless, Pablo asked his brother Héctor to join up. Falu joined up as songwriter and helped with composition, as well as backup vocals and some solo songs. <a href=""https://www.last.fm/music/Desakato"">Read more on Last.fm</a>",689474,13169
Kanye West,Reggaeton (Origen: Rock),Canción,Runaway,2010,3DK6m7It6Pw857FcQftMds,20r762YmB5HeofjMCiPMLv,84,"Ye, born Kanye Omari West on June 8, 1977, is an American rapper, singer, songwriter, record producer, and fashion designer. He is one of the most prominent figures in hip hop, known for his diverse musical style and polarizing cultural and political commentary. After dropping out of college to pursue a career in music, West began producing for regional artists in the Chicago area. As an in-house producer for Roc-A-Fella Records, he co-produced albums including Jay-Z's The Blueprint (2001) before signing with the label as a recording artist. <a href=""https://www.last.fm/music/Kanye+West"">Read more on Last.fm</a>",1445924983,7751041
Billy Ocean,Reggaeton (Origen: Rock),Canción,Caribbean Queen (No More Love On the Run),2010,4JEylZNW8SbO4zUyfVrpb7,7n4OT3zEZaEiyKKd6mFAhi,75,"Billy Ocean (born Leslie Sebastian Charles, 21 January 1950, Fyzabad, Trinidad) is a Grammy Award-winning British popular music performer who had a string of rhythm and blues-tinged international pop hits in the 1970s and 1980s. He was the main British R&B singer / songwriter of the 1980s. He waited seven years after scoring his first four UK top 20 successes, before accumulating a series of transatlantic successes, including three U.S. number ones. <a href=""https://www.last.fm/music/Billy+Ocean"">Read more on Last.fm</a>",8647113,951722
Celtas Cortos,Reggaeton (Origen: Rock),Canción,Lucha de gigantes,2010,6NPKh0gE3SqkZ7t9lGv1wG,429B2xusrEYa2548pbnLMu,43,"Spanish music group of celtic rock.

It was formed in Valladolid (Castilla y León) in 1986. Eight friends, four of which played in the group Almenara decided to participate in a music contest under the name ""Colectivo Eurofolk"". They won the first prize and continued to play together changing their name to Celtas Cortos.

They won another contest in April 1987, the prize was the production of an album. They shared the prize with two other winners, so they contributed three songs to the album Así es como suena: Folk joven. <a href=""https://www.last.fm/music/Celtas+Cortos"">Read more on Last.fm</a>",1655625,106073
Kanye West,Reggaeton (Origen: Rock),Canción,Monster,2010,1ZHYJ2Wwgxes4m8Ba88PeK,20r762YmB5HeofjMCiPMLv,76,"Ye, born Kanye Omari West on June 8, 1977, is an American rapper, singer, songwriter, record producer, and fashion designer. He is one of the most prominent figures in hip hop, known for his diverse musical style and polarizing cultural and political commentary. After dropping out of college to pursue a career in music, West began producing for regional artists in the Chicago area. As an in-house producer for Roc-A-Fella Records, he co-produced albums including Jay-Z's The Blueprint (2001) before signing with the label as a recording artist. <a href=""https://www.last.fm/music/Kanye+West"">Read more on Last.fm</a>",1445924983,7751041
Brandon Flowers,Reggaeton (Origen: Rock),Canción,Crossfire,2010,6S8r0pRxRUy3OF3UUtNjdN,7zKxFkMyehmw9u3MhLpMPK,61,"Brandon Richard Flowers (born June 21, 1981 in Henderson, Nevada, United States) is the vocalist and keyboardist in the American indie rock band The Killers. His older brother Shane, got him into music like The Smiths and Morrissey, The Beatles, The Cure and Queen. Brandon has played with U2, New Order, Pet Shop Boys, Bruce Springsteen and other bands of which he is a fan. 

While listening to the radio in his car after his very first college class, Flowers heard the song ""Changes"" by David Bowie. <a href=""https://www.last.fm/music/Brandon+Flowers"">Read more on Last.fm</a>",16390918,617564
Caramelos De Cianuro,Reggaeton (Origen: Rock),Canción,La Casa,2010,73jLhrKOby9QOBdAdpnsOl,249zicrXA7A4UjOrJnxeb0,59,"Caramelos de Cianuro is a Latin rock band from Venezuela. The band was formed in 1991, and recorded their first songs, ""Nadando a Traves De la Galaxia"" and ""Tu Mama Te Va a Pegar"", in 1992. A year later, the group signed up to CNR and released an EP called Las Paticas de la Abuela, followed by the band's first album, Cuentos Para Adultos, in 1994. Performing a mixture of Latin ska and pop rock, Caramelos de Cianuro returned in 1996 with Harakiri City, released by Polygram. <a href=""https://www.last.fm/music/Caramelos+de+Cianuro"">Read more on Last.fm</a>",2192486,60187
Rulo y la contrabanda,Reggaeton (Origen: Rock),Canción,Heridas del rock&roll,2010,5FazKQKTd45KmOAzhTN9Lv,4o1KACGnM1m7o3qoiM3hDx,43," <a href=""https://www.last.fm/music/Rulo+y+la+contrabanda"">Read more on Last.fm</a>",462529,18755
Arcade Fire,Reggaeton (Origen: Rock),Canción,The Suburbs,2010,5iItYl3Q6wCnKVfpK1uNVf,0gkUcpkyW2SXN49Yktkf6F,65,"Arcade Fire is a Canadian indie rock band formed in Montreal, Quebec, Canada in 2001. The band consists of Win Butler (vocals, guitar, piano), Régine Chassagne (vocals, accordion, keyboards, hurdy gurdy, drums), Richard Reed Parry (bass, guitar), Tim Kingsbury (bass), and Jeremy Gara (drums). Montreal percussionist Dane Mills performed on the EP and in early live shows.  Will Butler (keyboards, guitar) left the band in 2022 to focus on his solo career. The touring band includes horn players and violinists. <a href=""https://www.last.fm/music/Arcade+Fire"">Read more on Last.fm</a>",222581489,3064291
Black Eyed Peas,Reggaeton (Origen: Rock),Canción,Rock That Body,2010,74hXqhE6afQeZFPNcG0M6Q,0L0XGiaMNumFDbrKRlC6aS,59,"Black Eyed Peas is an American hip hop/pop group formed in Los Angeles in 1995. The group's current line-up consists of will.i.am, Taboo and apl.de.ap. Black Eyed Peas have so-far sold an estimated 56 million albums and singles worldwide.

Black Eyed Peas went to centenary state high school and got their start in 1988 when will.i.am (born 1975 William James Adams Jr.) and apl.de.ap (born 1974 Allan Pineda) began rapping and performing together around Los Angeles. <a href=""https://www.last.fm/music/Black+Eyed+Peas"">Read more on Last.fm</a>",144276508,5540105
Deftones,Reggaeton (Origen: Rock),Canción,Sextape,2010,1EryAkZ0VHstC6haIxVBiE,1GjjBpY2iDwSQs5bykQI5e,82,"Deftones is an American metal band from Sacramento, California, formed in 1988, consisting of Chino Moreno (lead vocals and guitar), Stephen Carpenter (guitar), Frank Delgado (keyboards and turntables), and Abe Cunningham (drums and percussion). Vega (formerly of Quicksand) took on bass duties from mid-2009 to ca. 2021 in substitution for Chi Cheng, who was seriously injured in an automobile accident in Santa Clara, California on November 4, 2008. <a href=""https://www.last.fm/music/Deftones"">Read more on Last.fm</a>",523845150,4052773
Bunbury,Reggaeton (Origen: Rock),Canción,Frente a frente (feat. Tulsa),2010,5kFkQoKmsuRZjjS4GEaxNj,2oOUx7YZnwBm4tshQbhdyO,70," <a href=""https://www.last.fm/music/+noredirect/Bunbury"">Read more on Last.fm</a>",5260706,147349
Celtas Cortos,Reggaeton (Origen: Rock),Canción,Blues del pescador,2010,4xX9iU4eZ2H5pyHva6Mssl,429B2xusrEYa2548pbnLMu,47,"Spanish music group of celtic rock.

It was formed in Valladolid (Castilla y León) in 1986. Eight friends, four of which played in the group Almenara decided to participate in a music contest under the name ""Colectivo Eurofolk"". They won the first prize and continued to play together changing their name to Celtas Cortos.

They won another contest in April 1987, the prize was the production of an album. They shared the prize with two other winners, so they contributed three songs to the album Así es como suena: Folk joven. <a href=""https://www.last.fm/music/Celtas+Cortos"">Read more on Last.fm</a>",1655625,106073
Kings of Leon,Reggaeton (Origen: Rock),Canción,Pyro,2010,0umDVf77ygI5RiVp9OvNDj,5xFZ4iElFbUFtOGX4lvdTM,77,"Kings of Leon is an American rock band formed in Nashville, Tennessee, in 1999. The band is composed of brothers Caleb, Nathan and Jared Followill, and their cousin Matthew Followill. The band's early music was a blend of Southern rock and garage rock with blues influences, but it has evolved throughout the years to include a variety of genres and a more alternative, arena rock sound. Kings of Leon achieved initial success in the United Kingdom with nine Top 40 singles <a href=""https://www.last.fm/music/Kings+of+Leon"">Read more on Last.fm</a>",261731799,5028583
Ken Zazpi,Reggaeton (Origen: Rock),Canción,Itsasoa gara,2010,6DzdQ1HhYMbsVKUHsIStIV,2DA8EK1eEmCbWPF3TfVceB,43,"Commercially successful Basque Pop-Rock project created in 1996 by Mikel Arronategi, former bass player of Exkixu and Eñaut Elorrieta former singer of Lugarri. <a href=""https://www.last.fm/music/Ken+Zazpi"">Read more on Last.fm</a>",352024,14288
