Artista,Género musical,Tipo,Nombre,Año de lanzamiento,ID_Spotify,ID_Album,Popularidad,Nombre_Album,Año_Lanzamiento_Album,Artista_Principal_Album,Biografia_Resumen,Playcount_LastFM,Listeners_LastFM
Bryce Janey,funk (Origen: funk),Canción,Funky Guitar Blues,2010,2dqkDzJPwSIduZlKJh0lvB,1ULW18kqQ47Qp3YUATkvFQ,42,Blues In My Soul,2010,Bryce Janey,"Bryce Janey began his career at age thirteen in a blues trio called “The Janeys.” His mother on drums and his father BillyLee on guitar. The Janey’s played regionally and nationally from Chicago to Los Angeles. Between 1991 and 1993 they performed with over 50 national acts including. 
After the Janey’s achieved some regional success, Bryce began a solo career and released his first CD in 1995. He has released three additional CD’s since 1996. <a href=""https://www.last.fm/music/Bryce+Janey"">Read more on Last.fm</a>",142353,25748
Funky Bijou,funk (Origen: funk),Canción,Funky Bijou Anthem,2010,3vqJENUjIAwBiWs5zVLWha,4ieRodIyGcBr9uU20D2MQU,35,Funky Bijou,2010,Funky Bijou," <a href=""https://www.last.fm/music/Funky+Bijou"">Read more on Last.fm</a>",56316,8626
Kasír,funk (Origen: funk),Canción,The Funky Spider,2010,5LXgUQ5VRmm7PsVBTnQyOn,6tZRWMS69RdXXvcuSC0ILj,34,Chilling on a Sunday,2010,Kasír,"Kasír are a young Danish trio, who play Irish folk music, both traditional tunes, and their own compositions. Composes of, Oisín Walsh, (1987), bodhrán, Rune Cygan Barslund, (1988), accordion and whistles and Aske Fuglsang Ruhe, (1989), guitar, mandolin and octave mandolin.


 <a href=""https://www.last.fm/music/Kas%C3%ADr"">Read more on Last.fm</a>",66571,11027
La Discothèque,funk (Origen: funk),Canción,Funkytown,2010,3fehLpIWjlE3YnTXRkqPN1,6CXNfnJUwEHFYUaiUNmeby,34,"La Discothèque, Vol. 2",2010,La Discothèque," <a href=""https://www.last.fm/music/La+discoth%C3%A8que"">Read more on Last.fm</a>",14002,4609
Tom Browne,funk (Origen: funk),Canción,Funkin' for Jamaica,2010,1es1B258zAVeXx6uzksrJd,34psLr9vLAgw49ehAgo6SJ,28,The Best Year Of My Life: 1981G010004775674D,2010,Various Artists,"Tom Browne (born October 30, 1954, Queens, New York), commonly referred to as ""Mr. Jamaica Funk"", is a jazz trumpeter who rose to prominence first through his early work with Sonny Fortune and for his #1 charting 1980 single ""Funkin' For Jamaica (N.Y)"" and notable dance tracks like ""Thighs High"". 

Browne originally played piano, having taken lessons from the age of 11. Turning to the trumpet, inspired by his collection of jazz albums, his first gig was in a Queens club, The Village Door. <a href=""https://www.last.fm/music/Tom+Browne"">Read more on Last.fm</a>",828300,173816
The Sequence,funk (Origen: funk),Canción,Funk You Up (12'' Version),2010,0IPMwsreFCYEYvzsvolNMf,5zxoU8Y4gWUyNcRLjknWky,23,A Complete Introduction to Sugar Hill Records,2010,Various Artists,"""The Sequence"" can refer to either a 1980's hip hop/funk group or a modern pop-rock band from southern California.

(1) The Sequence was an all-female old school hip hop/funk trio signed to the Sugar Hill label in the early 1980s. The group consisted of Cheryl (Cheryl The Pearl) Cook, Gwendolyn (Blondie) Chisolm, and lead singer/rapper Angie Stone, who subsequently became a member of Vertical Hold and later a solo artist.

(2) The Sequence consists of Travis Van Hoff (vocals), Jason Yata (Guitar), Brandon Dennis (Drums), and Kevin (Bass). <a href=""https://www.last.fm/music/The+Sequence"">Read more on Last.fm</a>",138613,23294
The Funky Town,funk (Origen: funk),Canción,Funky Town - 80's Mix,2010,19fsi2eY2FehBaIWb6IQYT,7MlkH4VAR03h19qaTVMFjn,23,"ReCovered Hits, Vol. 2",2010,Various Artists," <a href=""https://www.last.fm/music/The+Funky+town"">Read more on Last.fm</a>",5346,1521
Mr. Talkbox,funk (Origen: funk),Canción,Funkadelic Sound,2010,4Nh2oQHhRcVy16qYbRQ2Fw,0m5koUYDRGH9y53Kv9v9kV,26,My Time,2010,Mr. Talkbox," <a href=""https://www.last.fm/music/Mr.+Talkbox"">Read more on Last.fm</a>",31243,5806
D-Vision,funk (Origen: funk),Canción,Funky,2010,1W5ZHOVTpMavbqI3h85PRJ,482iqNPFAU1tZnQwLHTNr9,30,Funky,2010,D-Vision," <a href=""https://www.last.fm/music/D-vision"">Read more on Last.fm</a>",14239,2707
Maxipaul,funk (Origen: funk),Canción,Funk (Klubbed Mix),2010,5unrlCzR2G5A2O3Mpiw6mS,1e6kxyfq7sQkg4naSIPEXm,7,"Non - The History - Sesion Bumpin & Dance (Dj Gordy, Carlos Revuelta, Elias Dj, Dj Blod)",2010,Various Artists," <a href=""https://www.last.fm/music/Maxipaul"">Read more on Last.fm</a>",1209,307
Ben L'Oncle Soul,funk (Origen: funk),Canción,Soulman - New English Version,2010,6gUbpcQmFvDUbe7a213wlr,6XbYsGvaSrNPOrY9E5jRd7,54,Ben L'Oncle Soul,2010,Ben L'Oncle Soul,"Benjamin Duterde (born 1984), a.k.a. Ben L'Oncle Soul ('Ben the Soul Uncle'), is a French nu-soul singer from the town of Tours, France, who has released seven full-length studio albums and a live album since 2010.

Duterde first gained prominence in his home country with the Soul Wash EP (2009), which featured six covers (Gnarls Barkley, The White Stripes, Spice Girls and the like).  Ben's first full-length album, entitled simply Ben L'Oncle Soul was released in 2010 and was put out internationally on the Motown label. <a href=""https://www.last.fm/music/Ben+l%27Oncle+Soul"">Read more on Last.fm</a>",3056772,248912
Sharon Jones & The Dap-Kings,funk (Origen: funk),Canción,Better Things,2010,2dwzy3ZOiNbJ8TBGmVb8bw,7tsqjPwOhgPOWHgp9RHYi6,49,I Learned the Hard Way,2010,Sharon Jones & The Dap-Kings,"Sharon Jones & the Dap-Kings, aka Sharon Jones and the Dap-Kings, are a funk/soul band, founded in Brooklyn, NY, USA (1996). They are signed to Daptone Records, where the Dap-Kings are the house band. They are widely thought to be spearheads of a revivalist movement that aims to capture the essence of funk/soul music as it was at its height in the mid-1960s to mid-1970s. Part of the way this is achieved is to shun modern digital recording methods in favour of using traditional analogue recording equipment. <a href=""https://www.last.fm/music/+noredirect/Sharon+Jones+&+The+Dap-Kings"">Read more on Last.fm</a>",8756383,719002
The Jive Turkeys,funk (Origen: funk),Canción,Funky Brewster,2010,2OQierF1V3Cr1VRPuJ7p8U,1G8Wn22GUexwkJWWqbnusb,21,Bread & Butter,2010,The Jive Turkeys," <a href=""https://www.last.fm/music/The+Jive+Turkeys"">Read more on Last.fm</a>",36293,8026
Nate James,funk (Origen: funk),Canción,Funkdefining,2010,1yCH3BACq92DiuHXaE1nfx,70NnNY0ciHWu9I9uoHrK72,19,Kingdom Falls (recut),2010,Nate James,"Nates James is a British soul singer / songwriter who released his debut album, Set The Tone, in 2005. The album, heavily influenced by classic soul artists such as Prince and Stevie Wonder, won James widespread critical acclaim and two MOBO nominations for Best Newcomer and Best R&B Artist. The album, penned almost entirely by James, spans a wide variety of music styles, from the bassy R&B of ""Set The Tone"" and the upbeat pop of ""Universal"" to classic ballad ""Justify Me"" and verging on rock influences in ""I'll Decline"". <a href=""https://www.last.fm/music/Nate+James"">Read more on Last.fm</a>",373896,37501
George McCrae,funk (Origen: funk),Canción,Rock Your Baby,2010,6pMHMzwTsWIxLigr54GGVm,1Vmgke5bm1op8mUnbvd6wY,63,The Singles 1974 - 76,2010,George McCrae,"George McCrae (born October 19, 1944) is a Soul and Disco singer. McCrae was born in West Palm Beach, Florida. He formed his own singing group, the Jivin' Jets, before joining the United States Navy in 1963. Four years later, he reformed the group, with his wife Gwen joining the line-up, but soon afterwards they decided to work as a duo, recording for Henry Stone's Alston record label. Gwen then won a solo contract, with George acting as her manager as well as doing some singing on sessions and in clubs. <a href=""https://www.last.fm/music/George+McCrae"">Read more on Last.fm</a>",1780733,328181
Tony Bass,funk (Origen: funk),Canción,Funk Soul Brothers,2010,6fwG7emVASy8ppjoYdSfFy,41YIT8vcFtyVzl86RPNfWF,3,Sonido Masia - Bonus Track Session By Tony Bass,2010,Various Artists," <a href=""https://www.last.fm/music/Tony+Bass"">Read more on Last.fm</a>",5637,1646
NDKj,funk (Origen: funk),Canción,Funkest Star - Marshall Remix,2010,2N9fTRMRi0RIqLErvF0bOZ,0qZMHZbzauOr1wlLqJLNJE,4,We Call It House (Presented by Jochen Pash),2010,Various Artists,"DJ and producer NDKj aka: Andrea Quirico was born in 1981 in Novara (Italy). 

He became fascinated with electronic music – especially techno – at a young age and soon started djing himself. His first DJ appearance was in 1998 when he played in some smaller clubs and private parties in Northern Italy. At that time his sound was inspired by some of the big names in the techno scene who were known for playing hard but groovy techno. But “only” <a href=""https://www.last.fm/music/NDKj"">Read more on Last.fm</a>",14687,4643
Nils Landgren Funk Unit,funk (Origen: funk),Canción,Funk for Life,2010,5bBIXhATfpBogoukoXPg6R,2PbmDLYB75vcS0huv8cIR5,17,Funk for Life,2010,Nils Landgren Funk Unit,"Nils Landgren was born in 1956. He began playing drums at the age of six. At 13 he layed his hands and lips on the trombone and was hooked for life.
Between 1972 and 1978 Nils studied classical trombone at the music college in Karlstad with David Maytan and at the university in Arvika with Ingemar Roos. During this time he also met the legendary Swedish Folk-Jazz pioneer Bengt-Arne Wallin and the fantastic tromboneplayer and proffessor of the Graz Conservatory in Austria, Eje Thelin. <a href=""https://www.last.fm/music/Nils+Landgren+Funk+Unit"">Read more on Last.fm</a>",808582,76381
Whitefield Brothers,funk (Origen: funk),Canción,Safari Strut,2010,1lDELORqnHLLTe1bYmHLq7,4FXD1pVdJ5G690V7mRAFEL,45,Earthology,2010,Whitefield Brothers,"The Poets of Rhythm have been known by many pseudonyms. Bo Baral's Excursionists of Perception, Bus People Express, Dynamic Soundmakers, Karl Hector & the Funk Pilots, The Mercy Sluts, The Mighty Continentals, The New Process, Organized Raw Funk, The Pan-Atlantics, The Soul-Saints Orchestra, The Soul Sliders, Syrup, Das Geldene Zeitalter and The Woo Woo's to name - well most of them actually. But the constant at the centre of all these monikers is  Jan ('JJ')and Max ('Muggy') Weissenfeldt, or The Whitefield Brothers.

This bio needs adding to! <a href=""https://www.last.fm/music/Whitefield+Brothers"">Read more on Last.fm</a>",406247,57578
Delegation,funk (Origen: funk),Canción,In the Night,2010,5XfUou5EWPmu3wriE9Ox7O,1um0JgV0FOnEg3UA0IF2hc,40,The Best of Delegation,2010,Delegation,"1- Delegation is a disco band consisting of Ricky Bailey, Len Coley, Ray Patterson and Roddy Harris.
They started their career in the late 70s with the singles «The Promise Of Love» and ""Put A Little Love On Me"". Later on, Delegation released the albums «Delegation», «Eau De Vie», «Delegation II», «Deuces High» and «Encore». 

Ricky Bailey & Delegation... delivering all that's great about British 70's, 80's & 90's Soulful Funk!

Delegation one of the foremost recording and touring soul funk bands of the 70's <a href=""https://www.last.fm/music/Delegation"">Read more on Last.fm</a>",3340878,471965
Hot Toddy,funk (Origen: funk),Canción,Down to Love,2010,1WJ96y5wT3gQdrDGXEU2ZP,2FpLY1mr3pzDju1ujqRJbA,43,Late Night Boogie,2010,Hot Toddy,"There are two artists with the name Hot Toddy.

1. ""Hot Toddy"" is the solo moniker for Chris Todd, better known for my work with Crazy P formerly known as Crazy Penis, but has been writing music under the name of Hot Toddy since around 1998. His first releases were on the Nottingham based label Neon Heights and on  the Manchester based label, Paperecordings (the album ""Super Magic"", in 2001).  As Crazy P (at that time Crazy Penis) began to tour the <a href=""https://www.last.fm/music/Hot+Toddy"">Read more on Last.fm</a>",329322,58451
BadBoe,funk (Origen: funk),Canción,Funk In The Air - Fort Knox Five Remix,2010,1soUUXPht4ghlVUER1j7g5,6GEYaCbLIdNkTUJ90eWSyX,17,Break The Funk Remixed,2010,BadBoe,"Break beat music: http://www.myspace.com/djbadboe <a href=""https://www.last.fm/music/BadboE"">Read more on Last.fm</a>",118934,12591
Breakbot,funk (Origen: funk),Canción,Make You Mine,2010,1aKPbD7aGsySdLz27P92Gt,0sCktPXUOt19W503or8h9b,45,Baby I'm Yours,2010,Breakbot,"Breakbot aka Thibaut Berland is a French producer and DJ born in 1981. After studying at the School of Graphic Supinfocom, he made short films (with Oury Atlan and Damien Ferrié called ""Overtime.""), advertising and videos (David Hallyday - Satellite, Peter von Poehl - The Story of the Impossible). He is also a CG artist with credits including Arthur and the Invisibles. In may 2009 he was signed by Ed Banger Records.

Here's his bio on the Moshi Moshi Records site: <a href=""https://www.last.fm/music/Breakbot"">Read more on Last.fm</a>",11099691,791661
The Bamboos,funk (Origen: funk),Canción,On the Sly,2010,6TjdjwG2ZUWfuKpGxi9KBZ,5hbiYAop80Y2370lZPBGkh,39,4,2010,The Bamboos,"The Bamboos are an Australian deep funk and soul band hailing from Melbourne. Formed in 2000 by guitarist/producer Lance Ferguson, the band has gone through several lineup changes over the years, but Ferguson has remained a constant presence. They initially drew inspiration from the raw funk of the late 1960s and early 1970s, but their sound has evolved over time to incorporate elements of hip-hop, psychedelic pop, and even symphonic arrangements. <a href=""https://www.last.fm/music/The+Bamboos"">Read more on Last.fm</a>",3011328,294601
Joanne Shaw Taylor,funk (Origen: funk),Canción,Who Do You Love?,2010,5cyg2gV6FhAfj8h757d5L7,3Xa4Y2k4nLdtSoAyM1s5b8,39,Diamonds in the Dirt,2010,Joanne Shaw Taylor,"Joanne Shaw Taylor (born 1986, England) is a British blues rock guitarist and singer, who was discovered by Dave Stewart of the Eurythmics at the age of 16.

Taylor has toured Europe with the supergroup D.U.P. with fellow band members Dave Stewart (Eurythmics), Candy Dulfer (Prince), Mudbone Cooper (Parliment-Funkadelic) and Jimmy Cliff. If you can imagine the love child of Stevie Ray Vaughan and Dusty Springfield then you are beginning to get a feel for Taylor's mixture of fiery guitar playing, sultry vocals and 100% pure soul. <a href=""https://www.last.fm/music/Joanne+Shaw+Taylor"">Read more on Last.fm</a>",1015373,75809
Delegation,funk (Origen: funk),Canción,You and I,2010,1uGFGhxJ9ISGcy7iDffP7V,1um0JgV0FOnEg3UA0IF2hc,58,The Best of Delegation,2010,Delegation,"1- Delegation is a disco band consisting of Ricky Bailey, Len Coley, Ray Patterson and Roddy Harris.
They started their career in the late 70s with the singles «The Promise Of Love» and ""Put A Little Love On Me"". Later on, Delegation released the albums «Delegation», «Eau De Vie», «Delegation II», «Deuces High» and «Encore». 

Ricky Bailey & Delegation... delivering all that's great about British 70's, 80's & 90's Soulful Funk!

Delegation one of the foremost recording and touring soul funk bands of the 70's <a href=""https://www.last.fm/music/Delegation"">Read more on Last.fm</a>",3340878,471965
Odyssey,funk (Origen: funk),Canción,Going Back to My Roots - Single Version,2010,3wX42sUHbYqIC1ILpa4Akm,0pvhletDH7CphbKErUtPCF,38,80s 100 Hits,2010,Various Artists,"Odyssey is a name of at least nineteen acts:

1) A New York based U.S. billboard charts scored dance act.
2) A U.S. psychedelic rock group
3) A Swedish progressive metal band by Dan Swanö
4) A German eurodance project
5) A Greek project name used by Vangelis
6) A U.S. drum & bass producer
7) A later name of a band called Oracle
8) A U.S. Motown album by a pop group from 1972
9) A Brent Smedley (Iced Earth's drummer) solo group
10) A Polish electronica/ambient project <a href=""https://www.last.fm/music/Odyssey"">Read more on Last.fm</a>",1989752,304970
Delegation,funk (Origen: funk),Canción,Darlin' (I Think About You),2010,1NQFeJQOvirHNJ4lp17XUZ,1um0JgV0FOnEg3UA0IF2hc,45,The Best of Delegation,2010,Delegation,"1- Delegation is a disco band consisting of Ricky Bailey, Len Coley, Ray Patterson and Roddy Harris.
They started their career in the late 70s with the singles «The Promise Of Love» and ""Put A Little Love On Me"". Later on, Delegation released the albums «Delegation», «Eau De Vie», «Delegation II», «Deuces High» and «Encore». 

Ricky Bailey & Delegation... delivering all that's great about British 70's, 80's & 90's Soulful Funk!

Delegation one of the foremost recording and touring soul funk bands of the 70's <a href=""https://www.last.fm/music/Delegation"">Read more on Last.fm</a>",3340878,471965
Soopasoul,funk (Origen: funk),Canción,Summer Sun,2010,4Iqgo3AwdpGe5oDtB3vOHe,2PRjCxqGZgF6huq9ZrV0rZ,34,Summer Sun - Single,2010,Soopasoul,"The funk phoenix rises from the flames of rave. 

Soopasoul is that rarest of things in this electronic age of dance music. A band where everything is played in live, where loops and plug-ins are passed over in favour of a drum kit in the living room, guitars and bass that are lying around and a funky horn section so steeped in tradition that you can feel the real deal being played out in front of your ears. 

Danny Hybrid the man behind Soopasoul grew up in Manchester and has been a music pioneer since the age of 14. <a href=""https://www.last.fm/music/Soopasoul"">Read more on Last.fm</a>",226312,36253
Uffie,funk (Origen: funk),Canción,ADD SUV (feat. Pharrell Williams) - Armand Van Helden Club Remix,2010,7kE1g5T0Mmc84izq9DirqZ,7iAhrXrGRbPcXWL6E8xiIW,50,ADD SUV,2010,Uffie,"Anna-Catherine Hartley (born December 9, 1987), known professionally as Uffie, is an American-French singer, songwriter, rapper, DJ, and fashion designer formerly signed to French electronic music record label Ed Banger Records. Uffie's music incorporates synthpop, acid house, alternative dance, and ""somewhere between electro, rap and nu skool"". Her music is said to have ""had a lasting and widespread influence in the 2010s"" . 

She was born in Miami, raised in Hong Kong and now lives in Paris. <a href=""https://www.last.fm/music/Uffie"">Read more on Last.fm</a>",11419883,620404
Melba Moore,funk (Origen: funk),Canción,Love's Comin' At Ya - 2004 Digital Remaster,2010,2JXK3ELYkEcGTE4dsO4kYq,2H8dX8DEFqG96KEkzCv3Jd,49,Other Side Of The Rainbow,2010,Melba Moore,"Melba Hill, 29 October 1945, New York City, New York, USA. Based in New York, Melba Moore first attracted attention in the Broadway production of Hair. Although she has continued her thespian inclinations, winning an award for her performance in the musical Purlie, Moore has also forged a successful singing career. 'This Is It', a minor US hit, reached the UK Top 10 in 1976, and although her pop chart placings have since been inconsistent, Moore remained a fixture on the R&B lists over the following decade. <a href=""https://www.last.fm/music/Melba+Moore"">Read more on Last.fm</a>",677532,123188
Aloe Blacc,funk (Origen: funk),Canción,I Need A Dollar,2010,3oUphdZVPyrsprZ8FgbmQS,6G9PvX9f6Dq26JzsiVHIdl,70,Good Things,2010,Aloe Blacc,"Egbert Nathaniel Dawkins III (born 1979 in Orange County, California), better known by the stage name Aloe Blacc, is an American soul singer, rapper and musician. He began his recording career as an MC back in 1995 when he joined up with hip-hop producer Exile to form the mainstay indie rap group Emanon. Aloe released his debut solo album Shine Through on Stonethrow Records in 2006 and followed this up in 2010 with Good Things. He has also collaborated with the Cradle Orchestra under the name Bee <a href=""https://www.last.fm/music/Aloe+Blacc"">Read more on Last.fm</a>",14410801,1214964
Wild Cherry,funk (Origen: funk),Canción,Play That Funky Music - Single Version,2010,1Zg71dOvDOf63sXwYEnGol,1k7WkNHGPNPnri2tsowvtg,44,70s 100 Hits,2010,Various Artists,"Rob Parissi (lead vocals & guitar) was raised in the tough, diverse steel mill town of Mingo Junction, Ohio. Parissi graduated from Mingo High School in 1968. Rob formed his first band in 1970 in Steubenville, Ohio, one mile north of Mingo Jct. along the Ohio River. The band's name ""Wild Cherry"" was selected off a box of cough drops while Rob was recuperating from a brief hospital stay. The band played the Ohio Valley region, the West Virginia panhandle, and Pittsburgh, Pennsylvania. The original lineup is not known. <a href=""https://www.last.fm/music/Wild+Cherry"">Read more on Last.fm</a>",4077774,741815
Trombone Shorty,funk (Origen: funk),Canción,Something Beautiful,2010,1ZESGzWrFSwXPplkscUsUR,5J26uchSALEhy9xwkdeV5a,46,Backatown,2010,Trombone Shorty,"Troy ""Trombone Shorty"" Andrews (born January 2, 1986) is a trombone  and trumpet  player from New Orleans, Louisiana, United States. 

Troy Andrews is the younger brother of trumpeter and bandleader James Andrews . Growing up in New Orleans' Treme neighborhood, ""Trombone Shorty"" was participating in brass band parades as a child, carrying his trombone even before his arms were long enough to reach all the positions of the slide. Andrews was a bandleader by the age of 6. <a href=""https://www.last.fm/music/Trombone+Shorty"">Read more on Last.fm</a>",1798803,138319
"Earth, Wind & Fire",funk (Origen: funk),Canción,September,2010,3mL0pzaHLsjJoaGfvQWyD5,1k7WkNHGPNPnri2tsowvtg,40,70s 100 Hits,2010,Various Artists,"Earth, Wind & Fire (EW&F or EWF) is an American band whose music spans the genres of jazz, R&B, soul, funk, disco, pop, Latin, and Afro-pop. They are among the best-selling bands of all time, with sales of over 90 million records worldwide. The band was formed in Chicago by Maurice White in 1969, growing out of the Salty Peppers. Prominent members have included Verdine White, Philip Bailey, Ralph Johnson, Larry Dunn, Al McKay, Roland Bautista, Robert Brookins, Sonny Emory, Fred Ravel, Ronnie Laws, Sheldon Reynolds, and Andrew Woolfolk. <a href=""https://www.last.fm/music/Earth,+Wind+&+Fire"">Read more on Last.fm</a>",46411748,2839946
Jamiroquai,funk (Origen: funk),Canción,Smoke and Mirrors,2010,1JKh2bRSYxx04pBEmFM6Bt,5mTP7Oivpq88d7ZQ9DBt4F,44,Rock Dust Light Star (Deluxe Version),2010,Jamiroquai,"Jamiroquai is an English funk and acid jazz band from London. Formed in 1992, they are fronted by vocalist Jay Kay, and were prominent in the London-based funk and acid jazz movement of the 1990s. They built on their acid jazz sound in their early releases and later drew from rock, disco, electronic and Latin music genres. Lyrically, the group has addressed social and environmental justice. Kay has remained as the only original member through several line-up changes. <a href=""https://www.last.fm/music/Jamiroquai"">Read more on Last.fm</a>",98902130,2770951
Jamiroquai,funk (Origen: funk),Canción,All Good In The Hood,2010,6lYDFEsQRgCDj0cBKodzG0,5mTP7Oivpq88d7ZQ9DBt4F,46,Rock Dust Light Star (Deluxe Version),2010,Jamiroquai,"Jamiroquai is an English funk and acid jazz band from London. Formed in 1992, they are fronted by vocalist Jay Kay, and were prominent in the London-based funk and acid jazz movement of the 1990s. They built on their acid jazz sound in their early releases and later drew from rock, disco, electronic and Latin music genres. Lyrically, the group has addressed social and environmental justice. Kay has remained as the only original member through several line-up changes. <a href=""https://www.last.fm/music/Jamiroquai"">Read more on Last.fm</a>",98902130,2770951
Andre Crom,funk (Origen: funk),Canción,In The City - Original Mix,2010,46pC4olXs8c5WJOm9Pzrz6,2tjwTZsuoZe7YI8H5HZgnV,38,About You EP,2010,Andre Crom,"Andre Crom from Germany, had an amazing start into 2013: a #1 Beatport Deephouse Charts hit (Teenage Mutants & Hanging On).  Besides that, both his label and himself entered the „mostcharted labels/artists of 2012 list of Resident Advisor with # 8 for OFF Recordings and # 40 for Andre Crom.  The future does not look bad either: solo shows and label showcases all over the world are confirmed for the first half of 2013, including key events such as Sonar, A.D.E. and several ibiza gigs. <a href=""https://www.last.fm/music/Andre+Crom"">Read more on Last.fm</a>",141914,38597
Maxipaul,funk (Origen: funk),Canción,Funky Bad Beat (Klubbed Mix),2010,7J6PMEt87gELNyxLfBUTNN,77W1xlDEor6DKVfCSvV8ko,3,The Members Of The Table VII,2010,Maxipaul," <a href=""https://www.last.fm/music/Maxipaul"">Read more on Last.fm</a>",1209,307
Mary Nelson,funk (Origen: funk),Canción,Let's Groove,2010,5m41M8RJ8Vw7SYl5CV5aP4,5rcv1EpC7gPYICga33Z5iD,33,Funk Lounge Emotion,2010,Various Artists," <a href=""https://www.last.fm/music/Mary+Nelson"">Read more on Last.fm</a>",21371,4441
James Brown,funk (Origen: funk),Canción,Funky President (People It's Bad),2010,5NqTTlvWo6S9J1QW0rGLJI,0iQyfK5hgJyt9G9fsfr01X,20,The Singles: Vol. 9 1973-1975,2010,James Brown,"James Joseph Brown (May 3, 1933 – December 25, 2006) was an American entertainer, record producer, and bandleader. The central progenitor of funk music and a major figure of 20th century music, he is often referred to by the honorific nicknames ""the Hardest Working Man in Show Business"", ""Godfather of Soul"", ""Mr. Dynamite"", and ""Soul Brother No. 1"". In a career that lasted more than 50 years, he influenced the development of several music genres. <a href=""https://www.last.fm/music/James+Brown"">Read more on Last.fm</a>",36604163,2358140
